name,main_category,sub_category,image,link,ratings,no_of_ratings,discount_price,actual_price
Pakkad for Kitchen | Hot Pot Utensil Gripper | Pot Lifter with Vinyl Coated Handle | Multipurpose High Grade Stainless Ste...,home & kitchen,Kitchen & Dining,https://m.media-amazon.com/images/I/316xw6CKIPS._AC_UL320_.jpg,https://www.amazon.in/Kitchen-Utensil-Gripper-Multipurpose-Stainless/dp/B09FSYL97B/ref=sr_1_4880?qid=1679212659&s=kitchen&sr=1-4880,3.9,68,₹249,₹699
rena germany Steel 90mm Plastic Knife Set (Pack of 5),home & kitchen,Kitchen & Dining,https://m.media-amazon.com/images/I/511ZczoiZ2L._AC_UL320_.jpg,https://www.amazon.in/rena-germany-Steel-Plastic-Knife/dp/B0BS9G1NMK/ref=sr_1_4881?qid=1679212659&s=kitchen&sr=1-4881,,,₹289,₹370
"anantam homes Metal Kitchen Cutlery Holder Spoon and Fork Organiser for Dining Table (Round, Ivory, Medium)",home & kitchen,Kitchen & Dining,https://m.media-amazon.com/images/I/71TrCTKh4pL._AC_UL320_.jpg,https://www.amazon.in/anantam-homes-Kitchen-Organiser-Round-Ivory/dp/B08PKJFVD7/ref=sr_1_4882?qid=1679212659&s=kitchen&sr=1-4882,4.5,240,₹529,"₹1,499"
HOKIPO® Wooden Knife Holder for Kitchen - Universal Knives Holder Stand with 5 Slots,home & kitchen,Kitchen & Dining,https://m.media-amazon.com/images/I/71+G4Nt2FPL._AC_UL320_.jpg,https://www.amazon.in/HOKIPO%C2%AE-Wooden-Knife-Holder-Kitchen/dp/B07ZTJZY14/ref=sr_1_4883?qid=1679212659&s=kitchen&sr=1-4883,4.2,"1,272",₹599,₹799
Gas Lighter for Kitchen Use,home & kitchen,Kitchen & Dining,https://m.media-amazon.com/images/I/21rJFqRNmqL._AC_UL320_.jpg,https://www.amazon.in/Gas-Lighter-for-Kitchen-Use/dp/B0BX3TN84D/ref=sr_1_4884?qid=1679212659&s=kitchen&sr=1-4884,,,₹80,₹300
"Kuber Industries Stainless Steel Turner/Spatula for Dosa, Roti, Omlette, Parathas, PavBhaji (Silver), Standard",home & kitchen,Kitchen & Dining,https://m.media-amazon.com/images/I/51SjrZmPDjS._AC_UL320_.jpg,https://www.amazon.in/Kuber-Industries-Stainless-Parathas-PavBhaji/dp/B09PGBR6SC/ref=sr_1_4885?qid=1679212659&s=kitchen&sr=1-4885,3.8,45,₹190,₹199
"Kuber Industries Transparent 4 Seater Centre Table Cover (White),Polyvinyl Chloride (PVC),Rectangular,Pack of 1",home & kitchen,Kitchen & Dining,https://m.media-amazon.com/images/I/71RE4+TJGxL._AC_UL320_.jpg,https://www.amazon.in/Kuber-Industries-Seater-Transparent-Centre/dp/B07BPZMHF9/ref=sr_1_4886?qid=1679212659&s=kitchen&sr=1-4886,3.9,"1,297",₹106,₹249
"kesi 2 in 1 Dumpling Maker Mould Machine, Kitchen Making Tool with Ghughra Momos Maker Machine, Dumpling Skin Press Mould ...",home & kitchen,Kitchen & Dining,https://m.media-amazon.com/images/I/51t+9hCCxAL._AC_UL320_.jpg,https://www.amazon.in/Dumpling-Machine-Kitchen-MakingDumpling-Multicolour/dp/B0BWS4J8PM/ref=sr_1_4887?qid=1679212659&s=kitchen&sr=1-4887,3.4,6,₹599,₹999
"Ocean Ivory Hi Ball Glass, Set of 6, 320ml, Transparent",home & kitchen,Kitchen & Dining,https://m.media-amazon.com/images/I/518RGYGbg+L._AC_UL320_.jpg,https://www.amazon.in/Ocean-Ivory-Glass-320ml-Transparent/dp/B00QEUOB4G/ref=sr_1_4888?qid=1679212659&s=kitchen&sr=1-4888,4.4,538,,₹702
Frabble8 Cute-Elves 500ml Vacuum Insulated Stainless Steel Flask Water Bottle for Kids Boys Girls Travel Thermos Sipper wi...,home & kitchen,Kitchen & Dining,https://m.media-amazon.com/images/I/61LXUrfKTcL._AC_UL320_.jpg,https://www.amazon.in/Frabble8-Double-Insulated-Stainless-Thermos/dp/B07SBNDN75/ref=sr_1_4889?qid=1679212659&s=kitchen&sr=1-4889,4.1,688,₹699,₹999
Raghavendra Sarkar Heavy Base Straight Shot Glass Vodka Tequila Shot Glasses Crystal Glass Transperent(Set of 6; 65 Ml),home & kitchen,Kitchen & Dining,https://m.media-amazon.com/images/I/61JIhrH7L2S._AC_UL320_.jpg,https://www.amazon.in/Raghavendra-Sarkar-Straight-Tequila-Transperent/dp/B097TQ7QWQ/ref=sr_1_4890?qid=1679212659&s=kitchen&sr=1-4890,4.6,18,₹294,₹699
"Cello Swift Stainless Steel Double Walled Flask, Hot and Cold, 1800ml, 1pc, Silver",home & kitchen,Kitchen & Dining,https://m.media-amazon.com/images/I/41pzcnbxzgL._AC_UL320_.jpg,https://www.amazon.in/Cello-Swift-ThermoSteel-Flask-Silver/dp/B07MWDNTHF/ref=sr_1_4891?qid=1679212659&s=kitchen&sr=1-4891,4.0,270,"₹1,499","₹2,199"
"Treo By Milton Alfy Glass Storage Jar Set of 6, 100 ml, Assorted",home & kitchen,Kitchen & Dining,https://m.media-amazon.com/images/I/71YBd056WbL._AC_UL320_.jpg,https://www.amazon.in/Treo-Milton-Glass-Storage-Multi-Color/dp/B074N9CCHQ/ref=sr_1_4892?qid=1679212659&s=kitchen&sr=1-4892,4.1,519,₹418,₹550
"Fun Homes 2 Pieces Plastic Leakproof Drop Oil Bottle Olive Oil Dispenser for Kitchen Storage Container,1 LTR (Purple), Sta...",home & kitchen,Kitchen & Dining,https://m.media-amazon.com/images/I/71r+FxrMmZL._AC_UL320_.jpg,https://www.amazon.in/Fun-Homes-Leakproof-Dispenser-Container/dp/B08XVV7JQD/ref=sr_1_4893?qid=1679212659&s=kitchen&sr=1-4893,4.0,31,₹237,₹599
KITCHEN CLUE® Stainless Steel Water Storage Container for Kitchen Office & Home I HOT and Cold Water Jug/Dispenser Carry 5...,home & kitchen,Kitchen & Dining,https://m.media-amazon.com/images/I/718MHvFMVVL._AC_UL320_.jpg,https://www.amazon.in/KITCHEN-Stainless-Storage-Container-Dispenser/dp/B08XW5DQWG/ref=sr_1_4894?qid=1679212659&s=kitchen&sr=1-4894,4.3,49,"₹1,120","₹3,999"
Mr. Butler PET Bottle 1 Litre (Orange & Yellow) (Pack of 2),home & kitchen,Kitchen & Dining,https://m.media-amazon.com/images/I/616Xvp3RZ8L._AC_UL320_.jpg,https://www.amazon.in/Mr-Butler-Bottle-Orange-Yellow/dp/B00TTM8WN2/ref=sr_1_4895?qid=1679212659&s=kitchen&sr=1-4895,4.3,"1,178",,₹390
Kitchen Press Holder Stand Black matt Flat,home & kitchen,Kitchen & Dining,https://m.media-amazon.com/images/I/41ZRoQJE1UL._AC_UL320_.jpg,https://www.amazon.in/Kitchen-Press-Holder-Stand-Black/dp/B0BMT5W5XH/ref=sr_1_4896?qid=1679212659&s=kitchen&sr=1-4896,3.8,6,₹499,₹799
"LOFA Love For Arcade Beast Edition 1.8 Litre Motivational Water Bottle, Extra Large Transparent leakproof Gym Bottle with ...",home & kitchen,Kitchen & Dining,https://m.media-amazon.com/images/I/518Q3LWk4fL._AC_UL320_.jpg,https://www.amazon.in/LOFA-Love-Arcade-Transparent-Lightweight/dp/B08CT9DBCN/ref=sr_1_5113?qid=1679212663&s=kitchen&sr=1-5113,4.6,"2,669",₹799,"₹1,299"
"Tupperware Plastic Jar Set - 2.5 L, 2 Pieces, Transparent",home & kitchen,Kitchen & Dining,https://m.media-amazon.com/images/I/41aK-vV7tdL._AC_UL320_.jpg,https://www.amazon.in/Tupperware-Super-Batter-Storer-Small/dp/B07WJDKGSW/ref=sr_1_5114_mod_primary_new?qid=1679212663&s=kitchen&sbo=RZvfv%2F%2FHxDF%2BO5021pAnSA%3D%3D&sr=1-5114,4.3,"1,000",₹984,"₹1,180"
HurryShoppy Coconut Scraper Manual Machine Coconut Grater Steel Coconut Crusher Coconut Graters for Kitchen Coconut Peeler...,home & kitchen,Kitchen & Dining,https://m.media-amazon.com/images/I/61SsTy-AKsL._AC_UL320_.jpg,https://www.amazon.in/HurryShoppy-Coconut-Scraper-Machine-Scrapper/dp/B0BS3VPCK5/ref=sr_1_5115?qid=1679212663&s=kitchen&sr=1-5115,5.0,1,₹349,₹899
"Kuber Industries Copper Lota | Kalash for Puja | BPA Free, Non Toxic,Copper | Rustproof & Durable | With Added Health Bene...",home & kitchen,Kitchen & Dining,https://m.media-amazon.com/images/I/51VetMQKYnL._AC_UL320_.jpg,https://www.amazon.in/Kuber-Industries-Lota-Rustproof-Benefits/dp/B0B51H86XV/ref=sr_1_5116?qid=1679212663&s=kitchen&sr=1-5116,4.2,30,₹384,₹999
"sujata motor megaflow jar, 2.5 l",home & kitchen,Kitchen & Dining,https://m.media-amazon.com/images/I/4140Wm7LMuL._AC_UL320_.jpg,https://www.amazon.in/Sujata-Megaflow-Litres-Work-Motor/dp/B010B9HXJ0/ref=sr_1_5117?qid=1679212663&s=kitchen&sr=1-5117,4.3,195,"₹1,389","₹1,390"
Cassarina Multipurpose Premium Stainless Steel Meat Butcher Cleaver Chopper Knife | Heavy Duty Sharp Blade for Cutting Mea...,home & kitchen,Kitchen & Dining,https://m.media-amazon.com/images/I/51WXM2VlDeL._AC_UL320_.jpg,https://www.amazon.in/Cassarina-Multipurpose-Premium-Stainless-Vegetable/dp/B0BTQ431V2/ref=sr_1_5118?qid=1679212663&s=kitchen&sr=1-5118,5.0,1,₹299,₹699
"Sixfire Glass Tea and Coffee Cup, Cute Clear (Transparent) Tea Cups Glass, Set of 2 (230 Ml)",home & kitchen,Kitchen & Dining,https://m.media-amazon.com/images/I/71YWuvdPoCL._AC_UL320_.jpg,https://www.amazon.in/Sillio-Glass-Coffee-Clear-Transparent/dp/B08PBX77B3/ref=sr_1_5119?qid=1679212663&s=kitchen&sr=1-5119,4.2,"1,282",₹398,₹899
Meyer Pre-Seasoned Cast Iron Frypan | Cast Iron Skillet | Iron Pan | Induction Frying Pan | Iron Fry Pan | Omlette Pan | C...,home & kitchen,Kitchen & Dining,https://m.media-amazon.com/images/I/21C35HJxiwL._AC_UL320_.jpg,https://www.amazon.in/Meyer-Seasoned-Cast-Iron-Frypan/dp/B0813JBQ64/ref=sr_1_5120?qid=1679212663&s=kitchen&sr=1-5120,4.2,696,"₹1,700","₹2,375"
"Hawkins Futura Sealing Ring for 3 Litre Futura Pressure Cooker, Black, Standard (F40-16)",home & kitchen,Kitchen & Dining,https://m.media-amazon.com/images/I/61woWUDgJzL._AC_UL320_.jpg,https://www.amazon.in/Hawkins-F40-16-Sealing-3-Liter-Pressure/dp/B00CN0AX66/ref=sr_1_5121_mod_primary_new?qid=1679212663&s=kitchen&sbo=RZvfv%2F%2FHxDF%2BO5021pAnSA%3D%3D&sr=1-5121,4.2,271,,₹65
"Mahaware Modular Mini Oval Plastic Kitchen Container Set, 275ml, Set of 12, Blue",home & kitchen,Kitchen & Dining,https://m.media-amazon.com/images/I/51aMbq7OfSL._AC_UL320_.jpg,https://www.amazon.in/Mahaware-Modular-Mini-Plastic-Container/dp/B07XTRVMX4/ref=sr_1_5122?qid=1679212663&s=kitchen&sr=1-5122,4.1,"1,424",₹580,"₹1,599"
"Ice Scoop Set of 3, Multi-purpose Plastic Kitchen Scoops Bar Scooper for Canisters, Flour, Powders, Dry Foods, Candy, Pop ...",home & kitchen,Kitchen & Dining,https://m.media-amazon.com/images/I/61Xk3uXAISL._AC_UL320_.jpg,https://www.amazon.in/Multi-purpose-Plastic-Kitchen-Scooper-Canisters/dp/B07Y4XW62T/ref=sr_1_5123?qid=1679212663&s=kitchen&sr=1-5123,4.7,637,₹199,₹599
Plantex Stainless Steel 304 Grade Decan Napkin Ring/Towel Ring/Napkin Holder/Towel Hanger/Bathroom Accessories (Matt Black),home & kitchen,Kitchen & Dining,https://m.media-amazon.com/images/I/81g4ASLgmEL._AC_UL320_.jpg,https://www.amazon.in/Plantex-Stainless-Napkin-Bathroom-Accessories/dp/B0B758YH28/ref=sr_1_5124?qid=1679212663&s=kitchen&sr=1-5124,4.2,101,₹599,"₹1,799"
"Empathy Brand - Handle For Bisleri 20 Litre Water Bottle (Plastic, Blue)",home & kitchen,Kitchen & Dining,https://m.media-amazon.com/images/I/410l2ghPKaL._AC_UL320_.jpg,https://www.amazon.in/Empathy-Plastic-Handle-Water-Bottle/dp/B082792GN3/ref=sr_1_5125?qid=1679212663&s=kitchen&sr=1-5125,4.4,342,₹385,₹475
Panca Non Stick Aluminium Grill Pan Multi Snack Pan Sandwich Maker Uttapam Pan Chilla Pan Toast Pan Grilled Sandwich Snack...,home & kitchen,Kitchen & Dining,https://m.media-amazon.com/images/I/71v-1zEH07L._AC_UL320_.jpg,https://www.amazon.in/Aluminium-Grill-Pan-Sandwich-Multipurpose/dp/B08Y793ZV1/ref=sr_1_5126?qid=1679212663&s=kitchen&sr=1-5126,3.6,124,₹375,₹999
MAGENTA� Measuring Cups and Spoons Pack of 10 Combo with Silicon Series Spatula and Brush Set with Acrylic Handle,home & kitchen,Kitchen & Dining,https://m.media-amazon.com/images/I/61ITRoLwPgL._AC_UL320_.jpg,https://www.amazon.in/MAGENTA%C2%AE-Measuring-Silicon-Spatula-Acrylic/dp/B07NTP2BRS/ref=sr_1_5127?qid=1679212663&s=kitchen&sr=1-5127,4.3,272,₹289,₹459
HOME REPUBLIC Random 100 pcs Cupcake Liner Baking Cups Cupcake Mold Paper Muffin Cases Cake Decorating Tools Enjoy Shopping,home & kitchen,Kitchen & Dining,https://m.media-amazon.com/images/I/51cHKx0Br7L._AC_UL320_.jpg,https://www.amazon.in/REPUBLIC-100-Random-Cupcake-Decorating-Shopping/dp/B07R74DVZ4/ref=sr_1_5128?qid=1679212663&s=kitchen&sr=1-5128,3.9,663,₹199,₹399
"Cello Fridge Door Plastic Canisters, 9pc(500mlx3, 750mlx3, 1000mlx3), White",home & kitchen,Kitchen & Dining,https://m.media-amazon.com/images/I/71bH9w22z4L._AC_UL320_.jpg,https://www.amazon.in/Cello-Canisters-Pieces-500ml-Pieces-750ml-Pieces-1000ml/dp/B07XY4KM29/ref=sr_1_5129?qid=1679212663&s=kitchen&sr=1-5129,4.5,666,₹879,₹999
"NK-STORE Stainless Steel Oil Pourer/Dispenser, 1 Litres,",home & kitchen,Kitchen & Dining,https://m.media-amazon.com/images/I/31nVBk5YojL._AC_UL320_.jpg,https://www.amazon.in/NK-STORE-Stainless-Pourer-Dispenser-Litres/dp/B09H363BWB/ref=sr_1_5130?qid=1679212663&s=kitchen&sr=1-5130,3.8,40,₹249,₹899
Faigy Printed Hair Cutting Sheet Apron Hairdressing Gown Cape Hair Cutting Barber Cloth Salon Accessories - Multicolour,home & kitchen,Kitchen & Dining,https://m.media-amazon.com/images/I/61zIkmNexbL._AC_UL320_.jpg,https://www.amazon.in/Faigy-Printed-Cutting-Hairdressing-Accessories/dp/B09H5SZ2KY/ref=sr_1_5131?qid=1679212663&s=kitchen&sr=1-5131,3.3,15,₹140,₹399
DOVEAZ Tara Apple and Banana Fruit Storage Holder/Cover/Box Set - Pack of 2 (Red),home & kitchen,Kitchen & Dining,https://m.media-amazon.com/images/I/51sVruyaKmL._AC_UL320_.jpg,https://www.amazon.in/DOVEAZ-Plastic-Apple-Banana-Storage/dp/B07ZC8YPDR/ref=sr_1_5132?qid=1679212663&s=kitchen&sr=1-5132,4.0,142,₹189,₹399
"Leeonz® Porcelain Condiment Jar Spice Container with Lids - Bamboo Cap Holder Spot, Ceramic Serving Spoon, Wooden Tray - B...",home & kitchen,Kitchen & Dining,https://m.media-amazon.com/images/I/51UeqPRccgL._AC_UL320_.jpg,https://www.amazon.in/Leeonz%C2%AE-Porcelain-Condiment-Spice-Container/dp/B09VGRGSYW/ref=sr_1_5133?qid=1679212663&s=kitchen&sr=1-5133,4.5,98,₹919,"₹1,600"
Rock Tawa 9 Inch Kadhai (Pre-Seasoned Cast Iron) Black,home & kitchen,Kitchen & Dining,https://m.media-amazon.com/images/I/31r4hR2PAUL._AC_UL320_.jpg,https://www.amazon.in/Rock-Tawa-Inch-Kadhai-Pre-Seasoned/dp/B07QCXCMTC/ref=sr_1_5134?qid=1679212663&s=kitchen&sr=1-5134,4.2,"1,327",₹950,"₹2,250"
Catron Stainless Steel Salt or Pepper Grinder - Original Salt or Pepper Shakers with Adjustable Coarseness - Salt Grinders...,home & kitchen,Kitchen & Dining,https://m.media-amazon.com/images/I/91pLPthLO3L._AC_UL320_.jpg,https://www.amazon.in/Catron-Refillable-Professional-Stainless-Adjustable/dp/B09HCJYBPC/ref=sr_1_5135?qid=1679212663&s=kitchen&sr=1-5135,3.6,267,₹239,₹999
"Urban Platter Squeeze Bottle (Plastic, Transparent, All Types of sauces marinades, Mustard, Ketchup, and Oil) Pack of 3 - ...",home & kitchen,Kitchen & Dining,https://m.media-amazon.com/images/I/514mGnDAiDL._AC_UL320_.jpg,https://www.amazon.in/Urban-Platter-Dispenser-Condiment-Dressings/dp/B07S7VFVMS/ref=sr_1_5136?qid=1679212663&s=kitchen&sr=1-5136,3.6,89,,₹350
"COSMIIC GREENS 6 Pc Pack (S-2; M-2; L-2) Reusable Vegetable Fridge Bags Of 3 Sizes, Lightweight, Washable, Storage For Fru...",home & kitchen,Kitchen & Dining,https://m.media-amazon.com/images/W/IMAGERENDERING_521856-T1/images/I/71L2IJymHqL._AC_UL320_.jpg,https://www.amazon.in/Vegetable-Lightweight-Vegetables-Groceries-Organizer/dp/B0BFBS21SX/ref=sr_1_5305?qid=1679212666&s=kitchen&sr=1-5305,4.7,12,₹278,₹349
"KRUM 10 Inch Paper Plate Pack of 100, Off-white",home & kitchen,Kitchen & Dining,https://m.media-amazon.com/images/W/IMAGERENDERING_521856-T1/images/I/61DgCugvefS._AC_UL320_.jpg,https://www.amazon.in/Plant-Biomass-Pattal-Plate-Off-White/dp/B08ZDD7ZRC/ref=sr_1_5306?qid=1679212666&s=kitchen&sr=1-5306,3.0,91,₹145,₹299
Mamta Creations Wood Chandan Pata Board/Sandalwood Chandan Rubbing Board (6 Inch),home & kitchen,Kitchen & Dining,https://m.media-amazon.com/images/W/IMAGERENDERING_521856-T1/images/I/41k3SvGwXlL._AC_UL320_.jpg,https://www.amazon.in/Mamta-Creations-Handmade-Sandalwood-6-inches/dp/B07T3SMQ4P/ref=sr_1_5307?qid=1679212666&s=kitchen&sr=1-5307,3.9,681,₹225,₹499
"Appster 2"" Inch Symphony Compatible Cooler Wheels, 19mm Piller Size (Pack of 4 Pcs) Black",home & kitchen,Kitchen & Dining,https://m.media-amazon.com/images/W/IMAGERENDERING_521856-T1/images/I/511JWjNqixL._AC_UL320_.jpg,https://www.amazon.in/Appster-Symphony-Cooler-Wheels-Piller/dp/B09YR9GP2C/ref=sr_1_5308?qid=1679212666&s=kitchen&sr=1-5308,3.8,20,₹299,₹499
"NESTAR ® Plastic Egg Separator, Egg Yolk Separator Egg Strainer Filter Dishwasher Safe Kitchen Bake Tool (White )",home & kitchen,Kitchen & Dining,https://m.media-amazon.com/images/W/IMAGERENDERING_521856-T1/images/I/613TNDFrnfL._AC_UL320_.jpg,https://www.amazon.in/NESTAR%C2%AE-Separator-Cooking-Dishwasher-Kitchen/dp/B08GRYF6PF/ref=sr_1_5309?qid=1679212666&s=kitchen&sr=1-5309,4.0,669,₹196,₹225
"Anwaliya Edesia Tapered Ceramic Coffee Mugs, 250 ml, Set of 6, Pure Black",home & kitchen,Kitchen & Dining,https://m.media-amazon.com/images/W/IMAGERENDERING_521856-T1/images/I/61sY17+CudL._AC_UL320_.jpg,https://www.amazon.in/Anwaliya-Edesia-Ceramic-Coffee-Mugs/dp/B08HWKRKLY/ref=sr_1_5310?qid=1679212666&s=kitchen&sr=1-5310,4.2,351,₹625,"₹1,345"
"Amazon Brand - Solimo Stainless Steel Inner Casserole (Pink Silver, 450/900/1450 ml) -Set of 3",home & kitchen,Kitchen & Dining,https://m.media-amazon.com/images/W/IMAGERENDERING_521856-T1/images/I/71CkzUbRAiL._AC_UL320_.jpg,https://www.amazon.in/Amazon-Brand-Solimo-Inner-Casserole/dp/B08FXNBS2B/ref=sr_1_5311?qid=1679212666&s=kitchen&sr=1-5311,3.9,472,₹639,"₹1,300"
"Crystal - CC943 Oval Medium Stainless Steel Serving Spoon, Silver",home & kitchen,Kitchen & Dining,https://m.media-amazon.com/images/W/IMAGERENDERING_521856-T1/images/I/412Hvpzq70L._AC_UL320_.jpg,https://www.amazon.in/Crystal-Medium-Stainless-Serving-Silver/dp/B00UHEUFYK/ref=sr_1_5312?qid=1679212666&s=kitchen&sr=1-5312,4.5,266,,₹75
"Vinod 5 Pcs Stainless Steel Tope Set Without lid - 0.8 Litre, 1 Litre, 1.4 Litre, 1.8 Litre, 2.2 Litre, Induction and Gas ...",home & kitchen,Kitchen & Dining,https://m.media-amazon.com/images/W/IMAGERENDERING_521856-T1/images/I/71G7ydhU+0L._AC_UL320_.jpg,https://www.amazon.in/Vinod-Stainless-Steel-Tope-Without/dp/B09BFCNWNY/ref=sr_1_5313?qid=1679212666&s=kitchen&sr=1-5313,4.2,57,"₹1,549","₹2,060"
"Tupperware Plastic Tumbler - 340 ml, 4 Pieces, Multicolored",home & kitchen,Kitchen & Dining,https://m.media-amazon.com/images/W/IMAGERENDERING_521856-T1/images/I/31++4CwGl-L._AC_UL320_.jpg,https://www.amazon.in/Tupperware-Rainbow-Multi-Color-Tumbler/dp/B07VS8PTD6/ref=sr_1_5314?qid=1679212666&s=kitchen&sr=1-5314,4.4,9,₹699,₹720
"Prestige OMG DLX Induction Base Non-Stick Aluminium Deep Kadhai, 24cm, Red",home & kitchen,Kitchen & Dining,https://m.media-amazon.com/images/W/IMAGERENDERING_521856-T1/images/I/41mvxafm3BL._AC_UL320_.jpg,https://www.amazon.in/Prestige-Induction-Non-Stick-Aluminium-Kadai/dp/B07GPZ7JBX/ref=sr_1_5315?qid=1679212666&s=kitchen&sr=1-5315,4.1,525,,"₹1,500"
"Tosaa Non-Stick Kadhai, 18cm, Aluminium, Black",home & kitchen,Kitchen & Dining,https://m.media-amazon.com/images/W/IMAGERENDERING_521856-T1/images/I/811NAo9u3LL._AC_UL320_.jpg,https://www.amazon.in/Tosaa-Aluminium-Non-Stick-Kadhai-Black/dp/B00IMB7IEU/ref=sr_1_5316?qid=1679212666&s=kitchen&sr=1-5316,3.7,"1,555",₹463,₹550
"Amazon Brand - Solimo Stainless Steel Insulated 24 Hour Hot or Cold Water Bottle, 750 ml (Black)",home & kitchen,Kitchen & Dining,https://m.media-amazon.com/images/W/IMAGERENDERING_521856-T1/images/I/616QOPqB-CL._AC_UL320_.jpg,https://www.amazon.in/Amazon-Brand-Solimo-Stainless-Insulated/dp/B0B4WWK251/ref=sr_1_5317?qid=1679212666&s=kitchen&sr=1-5317,3.1,10,₹659,"₹1,080"
OXSAM Knife Sharpener Manual 3 Stage Knife Sharpener for Kitchen Knife Sharpener Rod Tool of Ceramic and Knives (Black),home & kitchen,Kitchen & Dining,https://m.media-amazon.com/images/W/IMAGERENDERING_521856-T1/images/I/51FiQwCA9RL._AC_UL320_.jpg,https://www.amazon.in/OXSAM-Sharpener-Manual-Kitchen-Ceramic/dp/B0BLKHGQ99/ref=sr_1_5318?qid=1679212666&s=kitchen&sr=1-5318,4.1,68,₹199,₹499
"MADHULI Fish Cutting Knife with Fish Scale Remover & Kitchen Scissor, Multipurpose Kitchen Tools, Meat Knife with Non-Slip...",home & kitchen,Kitchen & Dining,https://m.media-amazon.com/images/W/IMAGERENDERING_521856-T1/images/I/51mKwBCX+KL._AC_UL320_.jpg,https://www.amazon.in/MADHULI-Fish-Cutting-Multipurpose-Tools/dp/B0BV737J33/ref=sr_1_5319?qid=1679212666&s=kitchen&sr=1-5319,,,₹399,₹899
"Kuber Industries Plastic Bathroom Mug - 6 Pieces, Blue & Pink, 1000ml",home & kitchen,Kitchen & Dining,https://m.media-amazon.com/images/W/IMAGERENDERING_521856-T1/images/I/81oMj9QdciL._AC_UL320_.jpg,https://www.amazon.in/Kuber-Industries-Printed-Bathroom-KUBMART1254/dp/B08BSJ1FS5/ref=sr_1_5320?qid=1679212666&s=kitchen&sr=1-5320,4.0,236,₹189,₹499
Crevizon 2 Liter Motivational Water Bottle with Time Marker & Straw Drinkable Leakproof Tritan BPA for Camping Training Bi...,home & kitchen,Kitchen & Dining,https://m.media-amazon.com/images/W/IMAGERENDERING_521856-T1/images/I/61rqA7mgSSL._AC_UL320_.jpg,https://www.amazon.in/Crevizon-Motivational-Drinkable-Leakproof-Training/dp/B0BR1FM1SY/ref=sr_1_5321?qid=1679212666&s=kitchen&sr=1-5321,5.0,1,₹599,"₹1,249"
Wofier Stainless Steel Ghee Pot/Oil Container with Spoon 2 pcs (250 ml),home & kitchen,Kitchen & Dining,https://m.media-amazon.com/images/W/IMAGERENDERING_521856-T1/images/I/61GbSmISqNL._AC_UL320_.jpg,https://www.amazon.in/Wofier-Stainless-Steel-Container-Spoon/dp/B08WKL8DWN/ref=sr_1_5322?qid=1679212666&s=kitchen&sr=1-5322,4.6,2,₹259,₹499
"JSJPO {BLACK} Kitchen 8 Pcs Sets Airtight Rasoi Box Spice Storage Jar Masala Box Spice Container Idle for, Easy Flow Spice...",home & kitchen,Kitchen & Dining,https://m.media-amazon.com/images/W/IMAGERENDERING_521856-T1/images/I/61rdyMw0Y0L._AC_UL320_.jpg,https://www.amazon.in/JSJPO-Kitchen-Airtight-Storage-Container/dp/B0BV6B29WN/ref=sr_1_5323?qid=1679212666&s=kitchen&sr=1-5323,,,₹369,₹899
"Generic Rectangle Trays Set Of 2 | Serving Trays | Gift Item | Multipurpose Tray | Wooden Tray | Kitchen , Dining , Decora...",home & kitchen,Kitchen & Dining,https://m.media-amazon.com/images/W/IMAGERENDERING_521856-T1/images/I/61MQ-P6i-BL._AC_UL320_.jpg,https://www.amazon.in/Rectangle-Multipurpose-Decorative-Handicraft-Multicolor/dp/B09MB2BVBN/ref=sr_1_5324?qid=1679212666&s=kitchen&sr=1-5324,3.8,140,₹499,₹750
"Milton Eminent 400 Thermosteel Water Bottle, 369 ml, Black",home & kitchen,Kitchen & Dining,https://m.media-amazon.com/images/W/IMAGERENDERING_521856-T1/images/I/813mimFTy3L._AC_UL320_.jpg,https://www.amazon.in/Milton-Eminent-Thermosteel-Water-Bottle/dp/B07YNT8K5Z/ref=sr_1_5325?qid=1679212666&s=kitchen&sr=1-5325,4.3,340,₹715,₹955
PUNO Stainless Steel Kitchen Hot Mat/Hot Utensil Stand/Hot mats for Dining Table/Hot Pot Stand/hot mat for Kitchen(3 Piece),home & kitchen,Kitchen & Dining,https://m.media-amazon.com/images/W/IMAGERENDERING_521856-T1/images/I/41ZPWb6rjZL._AC_UL320_.jpg,https://www.amazon.in/Stainless-Steel-Kitchen-Utensil-Dining/dp/B08TT55MBT/ref=sr_1_5326?qid=1679212666&s=kitchen&sr=1-5326,4.1,164,₹355,₹799
Amazon Brand - Solimo Stainless Steel Dinnerware Set - 61 Pieces,home & kitchen,Kitchen & Dining,https://m.media-amazon.com/images/W/IMAGERENDERING_521856-T1/images/I/81ZnaacIpdL._AC_UL320_.jpg,https://www.amazon.in/Solimo-Stainless-Cookware-Silver-SOSS90/dp/B07P6S73ML/ref=sr_1_5327?qid=1679212666&s=kitchen&sr=1-5327,3.9,451,"₹2,918.16","₹5,500"
Suzec Stainless Steel Crinkle Cut Knife Vegetable Potato Chip Cutter with Wavy Blade Cutter,home & kitchen,Kitchen & Dining,https://m.media-amazon.com/images/W/IMAGERENDERING_521856-T1/images/I/51V3-4GcuSL._AC_UL320_.jpg,https://www.amazon.in/Suzec-Stainless-Crinkle-Vegetable-Potato/dp/B0B2X2HWPZ/ref=sr_1_5328?qid=1679212666&s=kitchen&sr=1-5328,4.0,9,₹99,₹999
"Sumeet Stainless Steel Double Walled Vacuum Flask / Water Bottle, with Flip Lid, 24 Hours Hot and Cold, 1000 ml, Silver",home & kitchen,Kitchen & Dining,https://m.media-amazon.com/images/W/IMAGERENDERING_521856-T2/images/I/61KN3tnv1pL._AC_UL320_.jpg,https://www.amazon.in/Sumeet-Stainless-Double-Walled-Vacuum/dp/B0BRYBZDKL/ref=sr_1_5329?qid=1679212667&s=kitchen&sr=1-5329,,,₹499,"₹1,520"
"HASTHIP® 2 PCS Vacuum Wine Bottle Stopper with Date Record, Vacuum Champagne Stoppers, Reusable Wine Preserver Bottle Save...",home & kitchen,Kitchen & Dining,https://m.media-amazon.com/images/W/IMAGERENDERING_521856-T2/images/I/61jtf-Ld9pL._AC_UL320_.jpg,https://www.amazon.in/HASTHIP%C2%AE-Champagne-Stoppers-Preserver-Christmas/dp/B09Q8ZBPVV/ref=sr_1_5330?qid=1679212667&s=kitchen&sr=1-5330,4.0,346,₹558,₹901
"VEDIK Sparsh Copper Water Bottle 1 Liter Leak Proof Lacquer Coated Pure Copper for Travelling Purpose, Yoga Ayurveda Heali...",home & kitchen,Kitchen & Dining,https://m.media-amazon.com/images/W/IMAGERENDERING_521856-T2/images/I/61M9YIGWgML._AC_UL320_.jpg,https://www.amazon.in/Lacquer-Travelling-Purpose-Ayurveda-Benefits/dp/B08QDJZFWY/ref=sr_1_5331?qid=1679212667&s=kitchen&sr=1-5331,3.8,43,₹589,₹899
"Golden Bird Stylish Square Glass Wine Beer Whisky Decanter for Scotch, Wine, Whiskey, Vodka, Tequila, Rum etc Pitcher Bott...",home & kitchen,Kitchen & Dining,https://m.media-amazon.com/images/W/IMAGERENDERING_521856-T2/images/I/7196F3YfgGL._AC_UL320_.jpg,https://www.amazon.in/Golden-Stylish-Decanter-Whiskey-Tequila/dp/B09NTW7S4G/ref=sr_1_5332?qid=1679212667&s=kitchen&sr=1-5332,3.7,159,₹569,"₹1,999"
"Offroad Cake Board 9, 8, 10 Inches Round Cake Boards - Cardboard Disposable Cake Pizza Circle Scalloped Tart Decorating Ba...",home & kitchen,Kitchen & Dining,https://m.media-amazon.com/images/W/IMAGERENDERING_521856-T2/images/I/71W7GACsTHL._AC_UL320_.jpg,https://www.amazon.in/Offroad-Board-Inches-Round-Boards/dp/B09SX128WQ/ref=sr_1_5333?qid=1679212667&s=kitchen&sr=1-5333,4.1,82,₹186,₹799
"Golden bird International Crystal Clear Toughened Glass Coffee Mug with Convenient Solid Handle Mug Set for Tea, Coffee, B...",home & kitchen,Kitchen & Dining,https://m.media-amazon.com/images/W/IMAGERENDERING_521856-T2/images/I/71k4+epygOL._AC_UL320_.jpg,https://www.amazon.in/Golden-Bird-International-Convenient-Cappuccino/dp/B08RMJ81QD/ref=sr_1_5334?qid=1679212667&s=kitchen&sr=1-5334,4.2,"1,195",₹639,"₹1,299"
