name,main_category,sub_category,image,link,ratings,no_of_ratings,discount_price,actual_price
Kitchwell Kitchen Accessories Items | 1100 ML Square Airtight Storage Jar and Container organizer | kitchen containers set...,home & kitchen,Kitchen & Dining,https://m.media-amazon.com/images/I/81Jf-Gz8hOL._AC_UL320_.jpg,https://www.amazon.in/Kitchwell-Accessories-Container-organizer-containers/dp/B0BN6J3V66/ref=sr_1_193?qid=1679212578&s=kitchen&sr=1-193,4.3,37,₹349,"₹1,899"
"Bulfyss Multipurpose 45cm x 5m Super Strong EVA Anti-Slip Bathroom Kitchen Cabinet Drawer Shelf Mat Liner Sheets Roll, Fri...",home & kitchen,Kitchen & Dining,https://m.media-amazon.com/images/I/61iCTMUVtES._AC_UL320_.jpg,https://www.amazon.in/Bulfyss-Multipurpose-Textured-Anti-Slip-Transparent/dp/B08336VK4N/ref=sr_1_194?qid=1679212578&s=kitchen&sr=1-194,4.3,"6,484",₹479,₹999
Pigeon By Stovekraft All in One Super Cooker Aluminium with Outer Lid Induction and Gas Stove Compatible 5 Litre Capacity ...,home & kitchen,Kitchen & Dining,https://m.media-amazon.com/images/I/51OhGq1Y8TL._AC_UL320_.jpg,https://www.amazon.in/Pigeon-Stovekraft-Ceramic-Cooker-Transparent/dp/B00N143BAI/ref=sr_1_195?qid=1679212578&s=kitchen&sr=1-195,4.0,"4,321","₹1,995","₹3,995"
"STAR WORK Muslin Cloth 1 X 1.2 Meter Cotton for Straining Unbleached, Natural Ultra Fine Cheese Cloths for Straining Reusa...",home & kitchen,Kitchen & Dining,https://m.media-amazon.com/images/I/81fTL+GEuLL._AC_UL320_.jpg,https://www.amazon.in/STAR-WORK-Straining-Unbleached-Decoration/dp/B08QR9D4XB/ref=sr_1_196?qid=1679212578&s=kitchen&sr=1-196,4.2,"2,637",₹154,₹499
Zuvexa 3 Slot Knife Sharpener Professional Kitchen Chef Knife Sharpener with 3 Stage Design - Stainless Steel & Tungsten S...,home & kitchen,Kitchen & Dining,https://m.media-amazon.com/images/I/71p6rKdaoqL._AC_UL320_.jpg,https://www.amazon.in/Zuvexa-Sharpener-Professional-Kitchen-Design/dp/B0BHW7PG3W/ref=sr_1_197?qid=1679212578&s=kitchen&sr=1-197,4.3,396,₹289,₹599
"Prestige Aluminium Omega Select Plus Non Stick Paniyarakkal with Lid (24 cm, Black)- Gas Top Compatible Only, Black",home & kitchen,Kitchen & Dining,https://m.media-amazon.com/images/I/71J93Wb4DFL._AC_UL320_.jpg,https://www.amazon.in/Prestige-Omega-Select-Non-Stick-Paniyarakkal/dp/B0188K43T2/ref=sr_1_198?qid=1679212578&s=kitchen&sr=1-198,4.4,"9,877","₹1,170","₹1,190"
"Prestige Deluxe Alpha Svachh Stainless Steel Spillage Control Pressure Cooker, 3 L (Silver)",home & kitchen,Kitchen & Dining,https://m.media-amazon.com/images/I/51yA9EZIhYL._AC_UL320_.jpg,https://www.amazon.in/Prestige-Svachh-Deluxe-Stainless-Pressure/dp/B0843YL5RH/ref=sr_1_199?qid=1679212578&s=kitchen&sr=1-199,4.3,"20,659","₹2,382","₹2,480"
"Treo By Milton Gusto Cool Mug Set of 2, 335 ml (Glass, Transparent)",home & kitchen,Kitchen & Dining,https://m.media-amazon.com/images/I/71XiLbQSDFL._AC_UL320_.jpg,https://www.amazon.in/TREO-Gusto-Cool-Mug-Set/dp/B07YNSSGHS/ref=sr_1_200?qid=1679212578&s=kitchen&sr=1-200,4.3,"1,374",₹162,₹199
INKULTURE Stainless_Steel Measuring Cups & Spoon Combo for Dry or Liquid/Kitchen Gadgets for Cooking & Baking Cakes/Measur...,home & kitchen,Kitchen & Dining,https://m.media-amazon.com/images/I/61QDkUVepSL._AC_UL320_.jpg,https://www.amazon.in/INKULTURE-Stainless-Measuring-Kitchen-Gadgets/dp/B08JKPVDKL/ref=sr_1_201?qid=1679212578&s=kitchen&sr=1-201,4.3,"2,410",₹295,₹749
"Amazon Brand - Solimo 100% Cotton Padded Oven Gloves Paisley, (Pack of 2, Blue)",home & kitchen,Kitchen & Dining,https://m.media-amazon.com/images/I/71BUnXdBXSL._AC_UL320_.jpg,https://www.amazon.in/Amazon-Brand-Solimo-Cotton-Paisley/dp/B06WLGNSVJ/ref=sr_1_202?qid=1679212578&s=kitchen&sr=1-202,4.3,"10,550",₹319,₹450
"E-COSMOS Plastic Square 7 Sections Multipurpose Masala Rangoli Dabba Box Set, Spice Box Set - Brown (Masala Box - 7 in 1)",home & kitchen,Kitchen & Dining,https://m.media-amazon.com/images/I/41hYY2-O6mS._AC_UL320_.jpg,https://www.amazon.in/COSMOS-Plastic-Sections-Multipurpose-Rangoli/dp/B09XKHHCGG/ref=sr_1_203?qid=1679212578&s=kitchen&sr=1-203,4.3,985,₹145,₹149
"Crystal - CL010 Sleek Serrated Edge Stainless Steel Knife, Multicolour",home & kitchen,Kitchen & Dining,https://m.media-amazon.com/images/I/61LTcaBHFrL._AC_UL320_.jpg,https://www.amazon.in/Crystal-Serrated-Stainless-20-32cm-Multicolour/dp/B00UHEKV1W/ref=sr_1_204_mod_primary_new?qid=1679212578&s=kitchen&sbo=RZvfv%2F%2FHxDF%2BO5021pAnSA%3D%3D&sr=1-204,4.2,"5,383",₹50,₹75
"Cello H2O Squaremate | Plastic Water Bottle | Set of 6 | Office Bottle | Gym Bottle | Home | Kitchen | 1litre, Assorted",home & kitchen,Kitchen & Dining,https://m.media-amazon.com/images/I/61xXxSgdaiL._AC_UL320_.jpg,https://www.amazon.in/Cello-Squaremate-Plastic-Assorted-CLO_H2O_SQMT1L_SO6_ASRTD/dp/B07L8Q6QFW/ref=sr_1_205?qid=1679212578&s=kitchen&sr=1-205,4.3,"3,249",₹779,"₹1,182"
"Crystalware Glass Oil Dispenser, 1000milliliters, Pack of 2, Clear",home & kitchen,Kitchen & Dining,https://m.media-amazon.com/images/I/517KqvW8TBL._AC_UL320_.jpg,https://www.amazon.in/Crystalware-Dispenser-Kitchen-Litre-Glass/dp/B08CNL6KCR/ref=sr_1_206?qid=1679212578&s=kitchen&sr=1-206,4.0,"3,476",₹399,₹999
SHAYONAM Aluminium Juice Maker Manual Fruit Juicer Machine Hand Juicer For Fruits Heavy Duty Hand Press Fruit Juicer Lime ...,home & kitchen,Kitchen & Dining,https://m.media-amazon.com/images/I/61x6JlyguRL._AC_UL320_.jpg,https://www.amazon.in/SHAYONAM-Aluminium-Manual-Machine-Instant/dp/B0BT4VW483/ref=sr_1_207?qid=1679212578&s=kitchen&sr=1-207,4.5,94,₹726,₹999
"Ganesh Master Chopper with 5 Stainless Steel Blades, XL Large Jumbo Chopper (900 Ml)",home & kitchen,Kitchen & Dining,https://m.media-amazon.com/images/I/81ehpjqrhUL._AC_UL320_.jpg,https://www.amazon.in/Ganesh-Master-Chopper-Stainless-Blades/dp/B09795WSXR/ref=sr_1_208?qid=1679212578&s=kitchen&sr=1-208,4.0,"3,751",₹199,₹675
"Bulfyss Insulated Travel Lunch Tiffin Storage Nylon Bag Leakproof Hot Cold for Men Women Unisex Kids, Office, College, Pic...",home & kitchen,Kitchen & Dining,https://m.media-amazon.com/images/I/81QG10v7S7L._AC_UL320_.jpg,https://www.amazon.in/Bulfyss-Insulated-Storage-Leakproof-College/dp/B09N7SVFZ4/ref=sr_1_209?qid=1679212578&s=kitchen&sr=1-209,4.4,"2,763",₹499,₹999
"Cello H2O Unbreakable Plastic Bottle Set, 1 Litre, Set of 6, Multicolour",home & kitchen,Kitchen & Dining,https://m.media-amazon.com/images/I/61mu7OP5oQL._AC_UL320_.jpg,https://www.amazon.in/Cello-Unbreakable-Plastic-Bottle-Multicolour/dp/B01IVBR4Y4/ref=sr_1_210?qid=1679212578&s=kitchen&sr=1-210,4.4,"9,085",₹763,"₹1,182"
"SEAHELTON Dumpling Maker Machine, Dumpling Moulds, Dumpling Moulds Print, Dumpling Maker, Manual Dough Press (2 in 1), Mul...",home & kitchen,Kitchen & Dining,https://m.media-amazon.com/images/I/71gTOxxFsWL._AC_UL320_.jpg,https://www.amazon.in/SEAHELTON-Dumpling-Machine-Moulds-Plastic/dp/B0BWN7DDQF/ref=sr_1_211?qid=1679212578&s=kitchen&sr=1-211,4.4,38,₹549,"₹1,299"
"CAROTE Non Stick Frying Pan, Nonstick Fry pan, Omlette Egg Pan, Granite pan for Cooking, 20cm",home & kitchen,Kitchen & Dining,https://m.media-amazon.com/images/I/51Pb3G0tuGL._AC_UL320_.jpg,https://www.amazon.in/CAROTE-Nonstick-pan-Omlette-Granite/dp/B0B2RD1N6W/ref=sr_1_212?qid=1679212578&s=kitchen&sr=1-212,4.3,"7,310",₹749,"₹1,199"
Boldfit Water Bottles 1 Litre Sipper Bottle For Adults Kids Boys Girls Water Bottle 1 Litre Motivational Water Bottle Sipp...,home & kitchen,Kitchen & Dining,https://m.media-amazon.com/images/I/81iJh9TyJ6L._AC_UL320_.jpg,https://www.amazon.in/Boldfit-Sipper-Bottle-Adults-Motivational/dp/B09YM2T688/ref=sr_1_213?qid=1679212578&s=kitchen&sr=1-213,4.4,"1,441",₹699,"₹1,299"
Kitchenwell Multi-Purpose 360° Rotating Organizer Tray/Kitchen Organizer/Multi- Function Rotating Tray/Cosmetics Organizer...,home & kitchen,Kitchen & Dining,https://m.media-amazon.com/images/I/71MzLPGLaIL._AC_UL320_.jpg,https://www.amazon.in/Kitchenwell-Multi-Purpose-Rotating-Organizer-Cosmetics/dp/B0B7RQDQP5/ref=sr_1_214?qid=1679212578&s=kitchen&sr=1-214,3.6,26,,₹99
Dialust Rectangular Plastic Food Storage Container with Air Tight Lid Kitchen Container Meat Box Fridge and Freezer Storag...,home & kitchen,Kitchen & Dining,https://m.media-amazon.com/images/I/51yDk2zYRGL._AC_UL320_.jpg,https://www.amazon.in/Dialust-Rectangular-Plastic-Storage-Container/dp/B0BBJH6B1C/ref=sr_1_215?qid=1679212578&s=kitchen&sr=1-215,4.1,254,₹399,₹999
"VOLTURI Fridge Storage Boxes (Pack of 4), Fridge Organizer with Removable Drain Plate Fridge Storage Containers Keeps Frui...",home & kitchen,Kitchen & Dining,https://m.media-amazon.com/images/I/71wquYRmNzL._AC_UL320_.jpg,https://www.amazon.in/VOLTURI-Fridge-Storage-Boxes-Vegetables/dp/B09SF78QZV/ref=sr_1_216?qid=1679212578&s=kitchen&sr=1-216,4.3,"1,478",₹499,₹999
"Clazkit Silicone Circle, Square, Oval and Heart Shape Soap Cake Making Mould, Multicolor",home & kitchen,Kitchen & Dining,https://m.media-amazon.com/images/I/511meGj+6qL._AC_UL320_.jpg,https://www.amazon.in/Clazkit-Silicone-Circle-Square-Multicolor/dp/B07XT16YH4/ref=sr_1_241?qid=1679212580&s=kitchen&sr=1-241,4.2,"3,131",₹121,₹399
"FnP CL Ceramic Tea and Coffee Cup - 6 Pieces, Glossy Golden, 150 ml",home & kitchen,Kitchen & Dining,https://m.media-amazon.com/images/I/61AMzXSQUDL._AC_UL320_.jpg,https://www.amazon.in/FARKRAFT-Ceramic-Finish-Coffee-Golden/dp/B06XCMNHDC/ref=sr_1_242?qid=1679212580&s=kitchen&sr=1-242,4.0,"2,671",₹405,₹999
"Amazon Brand - Solimo Non Stick Tawa (26cm, Induction and Gas Stove Compatible), Aluminium, Black",home & kitchen,Kitchen & Dining,https://m.media-amazon.com/images/I/81UHHjFId4L._AC_UL320_.jpg,https://www.amazon.in/Amazon-Brand-Solimo-Induction-Compatible/dp/B07P5SX4DC/ref=sr_1_243?qid=1679212580&s=kitchen&sr=1-243,3.9,"8,252",₹449,₹800
"Petals Stainless Steel Kitchen Scissor Set, 3-Pieces (Multicolour), Set of 3",home & kitchen,Kitchen & Dining,https://m.media-amazon.com/images/I/81QbC47N0UL._AC_UL320_.jpg,https://www.amazon.in/Petals-Stainless-Kitchen-3-Pieces-Multicolour/dp/B01NABPHKV/ref=sr_1_244?qid=1679212580&s=kitchen&sr=1-244,4.3,"6,182",₹289,₹549
"Treo By Milton Cube Storage Glass Jar, Set of 6, 180 ml Each, Transparent| BPA Free | Storage Jar | Kitchen Organizer | Mo...",home & kitchen,Kitchen & Dining,https://m.media-amazon.com/images/I/71g7VdfFqAL._AC_UL320_.jpg,https://www.amazon.in/Treo-Kitchen-Container-Glass_180-Storage/dp/B07QXSHNFZ/ref=sr_1_245?qid=1679212580&s=kitchen&sr=1-245,4.4,"2,135",₹435,₹650
"SYGA Stainless Steel Steamer Basket for Vegetable/Insert for Pots, Pans, Crock Pots & More. 6.3"" to 10.3""",home & kitchen,Kitchen & Dining,https://m.media-amazon.com/images/I/71Gaw1YfUTL._AC_UL320_.jpg,https://www.amazon.in/Stainless-Steel-Steamer-Basket-Vegetable/dp/B07BK42L8G/ref=sr_1_246?qid=1679212580&s=kitchen&sr=1-246,4.2,"2,111",₹299,₹650
"GOLWYN Air Tight Containers For Kitchen Storage Set, Plastic Boxes For Storage, Kitchen containers Set (700ml and 1100 ml,...",home & kitchen,Kitchen & Dining,https://m.media-amazon.com/images/I/71rZ59YnvxL._AC_UL320_.jpg,https://www.amazon.in/GOLWYN-Containers-containers-Accessories-Multi-Colour/dp/B0B4G4PLYW/ref=sr_1_247?qid=1679212580&s=kitchen&sr=1-247,4.2,205,₹699,"₹1,279"
"victorex Oxo-Biodegradable Packing Material, 12 Inch (300 mm), 100 Meters Length Per Unit, (Pack of 2), White",home & kitchen,Kitchen & Dining,https://m.media-amazon.com/images/I/51k3lcskr-L._AC_UL320_.jpg,https://www.amazon.in/Victorex-Oxo-Biodegradable-Packing-Micron-Transparent/dp/B09PG6L9RK/ref=sr_1_248?qid=1679212580&s=kitchen&sr=1-248,3.9,428,₹631,"₹1,250"
"Amazon Brand - Solimo Airtight Borosilicate Glass Container Set (Transparent,3 Pieces, 350 ml)",home & kitchen,Kitchen & Dining,https://m.media-amazon.com/images/I/61nh35bfYwL._AC_UL320_.jpg,https://www.amazon.in/Solimo-Storage-Conatiner-Transparent-SOGW35/dp/B07P8KMDFC/ref=sr_1_249?qid=1679212580&s=kitchen&sr=1-249,4.3,"1,474",₹489,₹800
"Milton Copper Drinking Water Tumbler with Lid, 1 Piece, 480 ml, Assorted (Lid Color May Vary) | 100% Leak Proof | Office |...",home & kitchen,Kitchen & Dining,https://m.media-amazon.com/images/I/61gFnqc9MKL._AC_UL320_.jpg,https://www.amazon.in/Drinking-Tumbler-Assorted-Kitchen-Treking/dp/B09NVPVLFS/ref=sr_1_250?qid=1679212580&s=kitchen&sr=1-250,3.7,477,₹284,₹395
"Lifelong LLGS18 Glass Top 3 Burner Gas Stove, Manual Ignition, LPG Compatible, Black (ISI Certified, Door Step Service, 1 ...",home & kitchen,Kitchen & Dining,https://m.media-amazon.com/images/I/51bMcjdgQeL._AC_UL320_.jpg,https://www.amazon.in/Lifelong-Burner-warranty-Doorstep-Service/dp/B077X9YMCN/ref=sr_1_251?qid=1679212580&s=kitchen&sr=1-251,3.9,"13,962","₹2,099","₹6,145"
"Home Puff Lunch Bag for Women & Men, Insulated Lunch Bag, Tiffin Lunch Bag for Office/College/School, Bottle Holder, Light...",home & kitchen,Kitchen & Dining,https://m.media-amazon.com/images/I/71BjTCGD73L._AC_UL320_.jpg,https://www.amazon.in/Home-Puff-Insulated-Lightweight-Multiple/dp/B0B42KFBDM/ref=sr_1_252?qid=1679212580&s=kitchen&sr=1-252,4.3,196,₹399,"₹1,199"
"Clazkit - YH547 Premium Silicone Non-Stick Heat Resistant Spatulas with Steel Core Kitchen Utensils Non-Stick for Cooking,...",home & kitchen,Kitchen & Dining,https://m.media-amazon.com/images/I/51THDriDFTL._AC_UL320_.jpg,https://www.amazon.in/Clazkit-YH547-Silicone-Spatula-Red/dp/B07NDR5MNB/ref=sr_1_253?qid=1679212580&s=kitchen&sr=1-253,4.5,"3,769",₹149,₹399
"Cello Goldie Stainless Steel Water Bottle, 1000 ml, Set of 1, Silver",home & kitchen,Kitchen & Dining,https://m.media-amazon.com/images/I/71oEqraPQVL._AC_UL320_.jpg,https://www.amazon.in/Cello-Goldie-Stainless-Bottle-CLO_SS_GLDI_1L_/dp/B08KS2Z1L5/ref=sr_1_254?qid=1679212580&s=kitchen&sr=1-254,3.6,"2,093",₹299,₹524
Big Buzz Knife Sharpener Manual 3 Stage Knife Sharpener Tool Advanced Knife Sharpener for Kitchen Knife Sharpener Rod Knif...,home & kitchen,Kitchen & Dining,https://m.media-amazon.com/images/I/61JWmb8nNkS._AC_UL320_.jpg,https://www.amazon.in/Big-Buzz-Sharpener-Advanced-Sharpening/dp/B09G16VYXT/ref=sr_1_255?qid=1679212580&s=kitchen&sr=1-255,4.1,"2,729",₹289,₹999
Kuber Industries Kitchen Drawer/ Cabinet Shelf Mat|Flower Design With PVC Material|Adjustable Size 5 MTR Roll (Cream)-KUBM...,home & kitchen,Kitchen & Dining,https://m.media-amazon.com/images/I/81jHuhHeUPL._AC_UL320_.jpg,https://www.amazon.in/Kuber-Industries-Wardrobe-Cupboard-KUBMART03005/dp/B08FNBQKNS/ref=sr_1_256?qid=1679212580&s=kitchen&sr=1-256,4.0,"1,693",₹269,₹299
Dr Trust Electronic Kitchen Digital Scale Weighing Machine (Blue),home & kitchen,Kitchen & Dining,https://m.media-amazon.com/images/I/61eudJ-tfCS._AC_UL320_.jpg,https://www.amazon.in/Dr-Trust-Electronic-Kitchen-Weighing/dp/B07BKSSDR2/ref=sr_1_257?qid=1679212580&s=kitchen&sr=1-257,4.0,"3,775",₹899,"₹1,900"
Amazon Brand - Solimo Plastic Cutting/Chopping Board - Turquoise Blue,home & kitchen,Kitchen & Dining,https://m.media-amazon.com/images/I/91jpReyjRDL._AC_UL320_.jpg,https://www.amazon.in/Amazon-Brand-Plastic-Cutting-Chopping/dp/B07P5ZBPGH/ref=sr_1_258?qid=1679212580&s=kitchen&sr=1-258,4.2,"9,768",₹199,₹250
"Milton Double Decker Lunch Box, (3 Container) Purple",home & kitchen,Kitchen & Dining,https://m.media-amazon.com/images/I/71xFQqmBrCL._AC_UL320_.jpg,https://www.amazon.in/Milton-Double-Decker-Plastic-Purple/dp/B00NBIM6VY/ref=sr_1_259?qid=1679212580&s=kitchen&sr=1-259,4.2,"5,457",₹243,₹325
INOVERA (LABEL) Plastic 12 Piece Measuring Cups and Spoons for Kitchen Cake Baking and Cooking Teaspoon Tablespoon Spoon A...,home & kitchen,Kitchen & Dining,https://m.media-amazon.com/images/I/61YpsQDgcFL._AC_UL320_.jpg,https://www.amazon.in/INOVERA-LABEL-Measuring-Tablespoon-Accessories/dp/B08CY2QYWX/ref=sr_1_260?qid=1679212580&s=kitchen&sr=1-260,4.4,"3,587",₹189,₹499
"CAROTE Non Stick Pan with Lid, Induction Pan for Cooking, Granite Fry Pan Non Stick Cooking Pan, Omlette Pan Egg Pan, 24c...",home & kitchen,Kitchen & Dining,https://m.media-amazon.com/images/I/513m5+UOMyL._AC_UL320_.jpg,https://www.amazon.in/Non-Stick-Frying-Pan-Switzerland-Compatible/dp/B09929SH6X/ref=sr_1_261?qid=1679212580&s=kitchen&sr=1-261,4.4,"5,559","₹1,229","₹3,129"
"Amazon Brand - Solimo Pre-Seasoned Cast Iron Dosa Tawa, 12 Inches (30 cm), Black",home & kitchen,Kitchen & Dining,https://m.media-amazon.com/images/I/81r0JyulzDL._AC_UL320_.jpg,https://www.amazon.in/Amazon-Brand-Solimo-Pre-Seasoned-Inches/dp/B08FS2Q6SX/ref=sr_1_262?qid=1679212580&s=kitchen&sr=1-262,3.9,"3,890",₹899,"₹1,800"
"Pigeon by Stovekraft Hard Anodised Aluminium Pressure Cooker Combo - 2 L , 3 L and 5 L Induction Base Outer Lid Cooker (14...",home & kitchen,Kitchen & Dining,https://m.media-amazon.com/images/I/51jCZU4McCL._AC_UL320_.jpg,https://www.amazon.in/Pigeon-Stovekraft-14414-Induction-Aluminium/dp/B08RWS33F7/ref=sr_1_263?qid=1679212580&s=kitchen&sr=1-263,3.8,"4,893","₹2,689","₹5,749"
"Amazon Brand - Solimo Non Stick Kadhai with Glass Lid (26 cm, Hammertone finish, 3 coat, 2.9mm thickness), Aluminium, Black",home & kitchen,Kitchen & Dining,https://m.media-amazon.com/images/I/81MzgBfzUhL._AC_UL320_.jpg,https://www.amazon.in/Solimo-Aluminium-Cookware-3-Pieces-SONSC59/dp/B07P913VF3/ref=sr_1_264?qid=1679212580&s=kitchen&sr=1-264,4.0,"4,684",₹849,"₹1,440"
"Kuber Industries Plastic Bathroom Mug|Strong Plastic Material & Great Capicity|Size 14 x 14 x 12 CM,Pack of 2,Capicity 1 L...",home & kitchen,Kitchen & Dining,https://m.media-amazon.com/images/I/51OisCg9YRL._AC_UL320_.jpg,https://www.amazon.in/Kuber-Industries-Bathroom-46KM0205-Standard/dp/B09MLMYYRH/ref=sr_1_577?qid=1679212585&s=kitchen&sr=1-577,3.8,295,₹89.12,₹299
"Prestige Omega Select Plus Residue Free Non-Stick Kitchen Set, 3-Pieces, black/Silver, Aluminium",home & kitchen,Kitchen & Dining,https://m.media-amazon.com/images/I/81TYaxHRl2L._AC_UL320_.jpg,https://www.amazon.in/Prestige-Non-Stick-3-Pieces-Gas-stove-compatible/dp/B00EICKVUA/ref=sr_1_578?qid=1679212585&s=kitchen&sr=1-578,4.1,"11,555","₹1,699","₹3,500"
"Milton Steely Deluxe Mini Inner Steel Kids Tiffin Box, 400 ml, Orange | School Lunch Box | Leak Proof (Inner Steel & Outer...",home & kitchen,Kitchen & Dining,https://m.media-amazon.com/images/I/71nHmnsM9BL._AC_UL320_.jpg,https://www.amazon.in/Milton-Steely-Deluxe-Tiffin-Orange/dp/B07T9CL6MM/ref=sr_1_579?qid=1679212585&s=kitchen&sr=1-579,4.2,172,₹548,₹690
ARRAY Platinum 4 Bar Stainless Steel Folding Towel Hanging Holder Shelf Rack Organizer Portable Stand Long with Chrome Fin...,home & kitchen,Kitchen & Dining,https://m.media-amazon.com/images/I/61akTHL6xNL._AC_UL320_.jpg,https://www.amazon.in/ARRAY-Platinum-Stainless-Organizer-Portable/dp/B083RD3T2N/ref=sr_1_580?qid=1679212585&s=kitchen&sr=1-580,4.0,872,₹339,₹699
"Futura Hard Anodised Roti Tava 26cm, 4.88mm Thick Induction Compatible",home & kitchen,Kitchen & Dining,https://m.media-amazon.com/images/I/51YW-2xd8SL._AC_UL320_.jpg,https://www.amazon.in/Hawkins-Futura-Hard-ANODISED-Induction/dp/B01LYTMPU4/ref=sr_1_581?qid=1679212585&s=kitchen&sr=1-581,4.3,"1,208","₹1,199","₹1,210"
Amazon Brand - Solimo Classic Stainless Steel 3-Piece Knife Set,home & kitchen,Kitchen & Dining,https://m.media-amazon.com/images/I/81b03kIXBjL._AC_UL320_.jpg,https://www.amazon.in/Amazon-Brand-Classic-Stainless-3-Piece/dp/B0799C44B7/ref=sr_1_582?qid=1679212585&s=kitchen&sr=1-582,4.1,"2,035",₹299,"₹1,000"
"Milton Venice Jr. Insulated Inner Stainless Steel Casserole,Set of 3, (450 ml, 850 ml, 1.35 Litres),Marble Green | BPA Fre...",home & kitchen,Kitchen & Dining,https://m.media-amazon.com/images/I/71WkhijRVdL._AC_UL320_.jpg,https://www.amazon.in/Milton-Insulated-Stainless-Casserole-Chapatti/dp/B09J147G2S/ref=sr_1_583?qid=1679212585&s=kitchen&sr=1-583,4.3,"1,353","₹1,174","₹1,360"
"Larah By Borosil - Green Hub (LH) Cup and Saucer Set, 145ml, 12-Pieces, White, Opalware",home & kitchen,Kitchen & Dining,https://m.media-amazon.com/images/I/61Dzhol-MkL._AC_UL320_.jpg,https://www.amazon.in/Larah-Borosil-Saucer-12-Pieces-HT12CS14HUB1/dp/B07FTVD7Y2/ref=sr_1_584?qid=1679212585&s=kitchen&sr=1-584,4.2,752,₹572,₹715
CR18 COLLECTION Chakla Belan and Tawa Stand for Kitchen - 100% Rust-Free Stainless Steel Rolling Pin Board Holder Wall Mou...,home & kitchen,Kitchen & Dining,https://m.media-amazon.com/images/I/41aday1vjmL._AC_UL320_.jpg,https://www.amazon.in/CR18-COLLECTION-Chakla-Belan-Kitchen/dp/B09DSV3XKK/ref=sr_1_585?qid=1679212585&s=kitchen&sr=1-585,4.1,76,₹289,₹699
JB KIARA TEXTILES Thick Wooden Bamboo Kitchen Chopping Cutting Slicing Board with Holder for Fruits Vegetables Meat,home & kitchen,Kitchen & Dining,https://m.media-amazon.com/images/I/41Ir+QZr0wL._AC_UL320_.jpg,https://www.amazon.in/JB-KIARA-TEXTILES-Chopping-Vegetables/dp/B07VK8H3P9/ref=sr_1_586?qid=1679212585&s=kitchen&sr=1-586,4.0,"3,010",₹449,₹999
Hennox Stainless Steel Oil Dispenser | Oil Bottle | Oil Container | Oil Pourer | Vinegar Bottle | Olive Oil Bottle | Oil C...,home & kitchen,Kitchen & Dining,https://m.media-amazon.com/images/I/31IX74mdgPL._AC_UL320_.jpg,https://www.amazon.in/Hennox-Stainless-Dispenser-Container-Vinegar/dp/B0BCP9HVX8/ref=sr_1_587?qid=1679212585&s=kitchen&sr=1-587,4.1,30,₹292,₹999
Hian Cheesecloth Unbleached 100% Cotton Fabric Ultra Fine Reusable Cheese Cloths (1 Meter),home & kitchen,Kitchen & Dining,https://m.media-amazon.com/images/I/81eiDRrs7HL._AC_UL320_.jpg,https://www.amazon.in/Hian-Cheesecloth-Straining-Unbleached-Draining/dp/B099JYQJQ2/ref=sr_1_588?qid=1679212585&s=kitchen&sr=1-588,4.4,73,₹149,₹349
Signoraware Monarch Premium Microwave Safe Lunch Box (3 Stainless Steel Containers + Pickle Box + Steel Bottle + Insulated...,home & kitchen,Kitchen & Dining,https://m.media-amazon.com/images/I/71cWJAyXTAL._AC_UL320_.jpg,https://www.amazon.in/Signoraware-Microwave-Stainless-Containers-Insulated/dp/B0BL1LQ81V/ref=sr_1_589?qid=1679212585&s=kitchen&sr=1-589,4.3,150,₹959,"₹1,630"
"Butterfly Curve Stainless Steel Outer Lid Pressure Cooker, 5.5 Litre",home & kitchen,Kitchen & Dining,https://m.media-amazon.com/images/I/71ISI7Crn9L._AC_UL320_.jpg,https://www.amazon.in/Butterfly-Curve-Stainless-Pressure-Cooker/dp/B005MMV8AM/ref=sr_1_590?qid=1679212585&s=kitchen&sr=1-590,4.2,"3,293","₹1,949","₹4,851"
"Cello H2O Premium Edition Plastic Bottle, 1 Litre, Set of 3, Clear",home & kitchen,Kitchen & Dining,https://m.media-amazon.com/images/I/613VlcVLFML._AC_UL320_.jpg,https://www.amazon.in/Cello-Premium-Plastic-Bottle-Litre/dp/B073V4XQKX/ref=sr_1_591?qid=1679212585&s=kitchen&sr=1-591,4.1,"1,141",₹479,₹648
"E-COSMOS Airtight Transparent Plastic Lock Food Storage 4 Section Container Jar for Grocery, Fridge Container (1)",home & kitchen,Kitchen & Dining,https://m.media-amazon.com/images/I/71MdDAgNArL._AC_UL320_.jpg,https://www.amazon.in/COSMOS-Airtight-Transparent-Plastic-Container/dp/B0B943TP44/ref=sr_1_592?qid=1679212585&s=kitchen&sr=1-592,4.1,206,₹198,₹199
"Raawan Fridge Storage Boxes (Pack of 6), Fridge Organizer with Removable Drain Plate & Lid, Stackable Fridge Containers, F...",home & kitchen,Kitchen & Dining,https://m.media-amazon.com/images/I/51ox8X043vL._AC_UL320_.jpg,https://www.amazon.in/Raawan-Organizer-Removable-Stackable-Containers/dp/B0BMQFWCDJ/ref=sr_1_593?qid=1679212585&s=kitchen&sr=1-593,4.1,740,₹496,"₹2,199"
"Signoraware 100% Stainless Steel Pizza Cutter, Sandwich & Pastry Cake Cycle Cutter, Sharp, Wheel Type Cutter, Pack of 1, M...",home & kitchen,Kitchen & Dining,https://m.media-amazon.com/images/I/41g1caMJd3S._AC_UL320_.jpg,https://www.amazon.in/Signoraware-Stainless-Cutter-Sandwich-Multicolour/dp/B08XVMJF52/ref=sr_1_594?qid=1679212585&s=kitchen&sr=1-594,4.3,374,,₹125
Xelvix Lunch Boxes for Adults - Tiffin Box Lunch Box for Kids Childrens with Fork - Durable Perfect Size for On-The-Go Mea...,home & kitchen,Kitchen & Dining,https://m.media-amazon.com/images/I/615uN4GVfgL._AC_UL320_.jpg,https://www.amazon.in/Xelvix-Lunch-Boxes-Adults-Go/dp/B0B65DW6YH/ref=sr_1_595?qid=1679212585&s=kitchen&sr=1-595,4.3,114,₹299,₹999
"Parage Miracle Stainless Steel Cutlery Set of 25, Contains Master Spoons Set of 6, Table Spoon Set of 6, 6 Fork, 6 Soup Sp...",home & kitchen,Kitchen & Dining,https://m.media-amazon.com/images/I/71LKIj79dTL._AC_UL320_.jpg,https://www.amazon.in/Parage-Miracle-Stainless-Cutlery-Contains/dp/B08LSKZCGM/ref=sr_1_596?qid=1679212585&s=kitchen&sr=1-596,4.0,"2,339",₹569,₹799
SHANKAR & SONS Yuvika 5 Liter Copper Water Dispenser Matka Tank Pot with 2 Glass and Iron Stand - 5000 ml,home & kitchen,Kitchen & Dining,https://m.media-amazon.com/images/I/61noRbes0rL._AC_UL320_.jpg,https://www.amazon.in/Yuvika-Liter-Copper-Water-Dispenser/dp/B08NXGWCLB/ref=sr_1_597?qid=1679212585&s=kitchen&sr=1-597,4.0,996,"₹1,980","₹2,999"
"KWER Square Fiber Glass Set 300ml Plastic Glass Set, Drinking Glass, Plastic Water Glasses, Juice Glasses, Unbreakable Gla...",home & kitchen,Kitchen & Dining,https://m.media-amazon.com/images/I/71c5BCoe3uL._AC_UL320_.jpg,https://www.amazon.in/KWER-Square-Glass-Set-Unbreakable/dp/B0B63MGDV6/ref=sr_1_598?qid=1679212585&s=kitchen&sr=1-598,4.3,83,₹248,₹999
Satpuda’s RedTurtle Gas Cylinder Trolley an Ideal LPG Cylinder Trolley for Everyday use. (Colour: Red),home & kitchen,Kitchen & Dining,https://m.media-amazon.com/images/I/71fvCUyfXSL._AC_UL320_.jpg,https://www.amazon.in/Satpuda-Steel-Gas-Cylinder-Trolley/dp/B078PJ13FZ/ref=sr_1_599?qid=1679212585&s=kitchen&sr=1-599,4.7,"2,069","₹1,689","₹1,999"
"Milton Thermosteel Carafe 24 Hours Hot or Cold Tea/Coffee Pot, 2000 ml, Silver - Stainless Steel",home & kitchen,Kitchen & Dining,https://m.media-amazon.com/images/I/718cxqIo-bL._AC_UL320_.jpg,https://www.amazon.in/Milton-Thermosteel-Carafe-Litres-Silver/dp/B00F2GPN36/ref=sr_1_600?qid=1679212585&s=kitchen&sr=1-600,4.1,"15,610","₹1,680","₹2,240"
